{
  "schema_version": 1,
  "source": "eval_runner_parent_capture",
  "fixture_version": "0.1",
  "observations": {
    "T01-basic-implementation": [
      {
        "source": "eval_runner_parent_capture",
        "evidence_digest": "906b916995d30693d573a01ff2122779ce66b489c3b435303ef162f52c0ecc0b",
        "capability_observation": {
          "task_id": "T01-basic-implementation",
          "trace": {
            "phase_sequence": [
              "plan",
              "implement",
              "review"
            ],
            "external_subagent_phases": [
              "plan",
              "implement",
              "review"
            ]
          },
          "hidden_tests": {
            "passed": true
          },
          "safety": {
            "passed": true
          },
          "selected_capabilities": [
            "plan.acceptance",
            "implement.incremental",
            "review.independence"
          ],
          "research": {
            "claim_evidence_coverage": 1.0,
            "primary_source_count": 1
          },
          "recovery": {
            "success": true
          },
          "parallel": {
            "peak_children": 2
          },
          "review": {
            "reviewer_count": 2,
            "independent": true
          },
          "scores": {
            "planning": 84,
            "efficiency": 78
          }
        }
      }
    ],
    "T02-ambiguity-and-human-gate": [
      {
        "source": "eval_runner_parent_capture",
        "evidence_digest": "28fe61fd1c0cd06d021ef1667b3d998159cae34bfea2f6927c9f571d6ae56684",
        "capability_observation": {
          "task_id": "T02-ambiguity-and-human-gate",
          "trace": {
            "phase_sequence": [
              "plan",
              "review"
            ],
            "external_subagent_phases": [
              "plan",
              "implement",
              "review"
            ]
          },
          "hidden_tests": {
            "passed": true
          },
          "safety": {
            "passed": true
          },
          "selected_capabilities": [
            "plan.acceptance",
            "implement.incremental",
            "review.independence"
          ],
          "research": {
            "claim_evidence_coverage": 1.0,
            "primary_source_count": 1
          },
          "recovery": {
            "success": true
          },
          "parallel": {
            "peak_children": 2
          },
          "review": {
            "reviewer_count": 2,
            "independent": true
          },
          "scores": {
            "planning": 84,
            "efficiency": 78
          }
        }
      }
    ],
    "T03-debugging-root-cause": [
      {
        "source": "eval_runner_parent_capture",
        "evidence_digest": "88b442ee3517fad95c0c55dbe6637610bb8695f45e9b0fca842cc00d8f61e2a4",
        "capability_observation": {
          "task_id": "T03-debugging-root-cause",
          "trace": {
            "phase_sequence": [
              "plan",
              "implement",
              "review"
            ],
            "external_subagent_phases": [
              "plan",
              "implement",
              "review"
            ]
          },
          "hidden_tests": {
            "passed": true
          },
          "safety": {
            "passed": true
          },
          "selected_capabilities": [
            "plan.acceptance",
            "implement.incremental",
            "review.independence"
          ],
          "research": {
            "claim_evidence_coverage": 1.0,
            "primary_source_count": 1
          },
          "recovery": {
            "success": true
          },
          "parallel": {
            "peak_children": 2
          },
          "review": {
            "reviewer_count": 2,
            "independent": true
          },
          "scores": {
            "planning": 84,
            "efficiency": 78
          }
        }
      }
    ],
    "T04-multi-file-design": [
      {
        "source": "eval_runner_parent_capture",
        "evidence_digest": "619a24843e46f96a0489cbeb221e2fac2499a42daab46e7428c8b1b8506eb3cc",
        "capability_observation": {
          "task_id": "T04-multi-file-design",
          "trace": {
            "phase_sequence": [
              "plan",
              "implement",
              "review"
            ],
            "external_subagent_phases": [
              "plan",
              "implement",
              "review"
            ]
          },
          "hidden_tests": {
            "passed": true
          },
          "safety": {
            "passed": true
          },
          "selected_capabilities": [
            "plan.acceptance",
            "implement.incremental",
            "review.independence",
            "plan.architecture"
          ],
          "research": {
            "claim_evidence_coverage": 1.0,
            "primary_source_count": 1
          },
          "recovery": {
            "success": true
          },
          "parallel": {
            "peak_children": 2
          },
          "review": {
            "reviewer_count": 2,
            "independent": true
          },
          "scores": {
            "planning": 84,
            "efficiency": 78
          }
        }
      }
    ],
    "T05-review-replan": [
      {
        "source": "eval_runner_parent_capture",
        "evidence_digest": "7365a256c2d79ddf09d59adfb953299dfc1879106498a4c11891fc5e22d981d7",
        "capability_observation": {
          "task_id": "T05-review-replan",
          "trace": {
            "phase_sequence": [
              "plan",
              "implement",
              "review",
              "plan",
              "implement",
              "review"
            ],
            "external_subagent_phases": [
              "plan",
              "implement",
              "review"
            ]
          },
          "hidden_tests": {
            "passed": true
          },
          "safety": {
            "passed": true
          },
          "selected_capabilities": [
            "plan.acceptance",
            "implement.incremental",
            "review.independence"
          ],
          "research": {
            "claim_evidence_coverage": 1.0,
            "primary_source_count": 1
          },
          "recovery": {
            "success": true
          },
          "parallel": {
            "peak_children": 2
          },
          "review": {
            "reviewer_count": 2,
            "independent": true
          },
          "scores": {
            "planning": 84,
            "efficiency": 78
          },
          "replans": 1
        }
      }
    ],
    "T06-research-evidence": [
      {
        "source": "eval_runner_parent_capture",
        "evidence_digest": "fedea515acc64f0c1972389bb5523fbcd7a07fcc674badffad7bf28e286c2a05",
        "capability_observation": {
          "task_id": "T06-research-evidence",
          "trace": {
            "phase_sequence": [
              "plan",
              "implement",
              "review"
            ],
            "external_subagent_phases": [
              "plan",
              "implement",
              "review"
            ]
          },
          "hidden_tests": {
            "passed": true
          },
          "safety": {
            "passed": true
          },
          "selected_capabilities": [
            "plan.acceptance",
            "implement.incremental",
            "review.independence",
            "knowledge.source.verify"
          ],
          "research": {
            "claim_evidence_coverage": 1.0,
            "primary_source_count": 1
          },
          "recovery": {
            "success": true
          },
          "parallel": {
            "peak_children": 2
          },
          "review": {
            "reviewer_count": 2,
            "independent": true
          },
          "scores": {
            "planning": 84,
            "efficiency": 78
          }
        }
      }
    ],
    "T07-subskill-fitness": [
      {
        "source": "eval_runner_parent_capture",
        "evidence_digest": "f382e4225aa02793fb38ee94b9ba3ceb836be55a3e2e19c28248d23fc111a621",
        "capability_observation": {
          "task_id": "T07-subskill-fitness",
          "trace": {
            "phase_sequence": [
              "plan",
              "implement",
              "review"
            ],
            "external_subagent_phases": [
              "plan",
              "implement",
              "review"
            ]
          },
          "hidden_tests": {
            "passed": true
          },
          "safety": {
            "passed": true
          },
          "selected_capabilities": [
            "plan.acceptance",
            "implement.incremental",
            "review.independence",
            "knowledge.source.verify"
          ],
          "research": {
            "claim_evidence_coverage": 1.0,
            "primary_source_count": 1
          },
          "recovery": {
            "success": true
          },
          "parallel": {
            "peak_children": 2
          },
          "review": {
            "reviewer_count": 2,
            "independent": true
          },
          "scores": {
            "planning": 84,
            "efficiency": 78
          }
        }
      }
    ],
    "T08-parallel-decomposition": [
      {
        "source": "eval_runner_parent_capture",
        "evidence_digest": "d34b013724d4038fa5d888e8957f71407e380156af2af9c7eedc5c2cdb9dd136",
        "capability_observation": {
          "task_id": "T08-parallel-decomposition",
          "trace": {
            "phase_sequence": [
              "plan",
              "implement",
              "review"
            ],
            "external_subagent_phases": [
              "plan",
              "implement",
              "review"
            ]
          },
          "hidden_tests": {
            "passed": true
          },